imdb_id,director,plot,box_office,poster_url,runtime_minutes,metascore,movieId,title,release_year,status
tt0119558,Adrian Lyne,"An English professor falls for a minor, and has to face the consequences of his actions.",1071255.0,https://m.media-amazon.com/images/M/MV5BMTRmN2FlYjUtOTQyNi00YTA3LWI0Y2YtNDIyMWQ0Y2IwYjhlXkEyXkFqcGc@._V1_SX300.jpg,137.0,46.0,2025,Lolita (1997),1997.0,success
tt0134619,David Nutter,"The new kid in Cradle Bay, Washington stumbles across something sinister about the town's method of transforming its unruly teens into upstanding citizens.",17514980.0,https://m.media-amazon.com/images/M/MV5BMjE2YWJhOTctZTE4Yy00ZDZhLTkzNGEtNzgzOGNjZWM5YWYwXkEyXkFqcGc@._V1_SX300.jpg,84.0,,2026,Disturbing Behavior (1998),1998.0,success
tt0120815,Steven Spielberg,"Following the Normandy Landings, a group of U.S. soldiers go behind enemy lines to retrieve a paratrooper whose comrades have been killed in action.",217049603.0,https://m.media-amazon.com/images/M/MV5BZGZhZGQ1ZWUtZTZjYS00MDJhLWFkYjctN2ZlYjE5NWYwZDM2XkEyXkFqcGc@._V1_SX300.jpg,169.0,91.0,2028,Saving Private Ryan (1998),1998.0,success
tt0062737,Robert Stevenson,"Track coach Steve Walker accidentally invokes the spirit of notorious pirate Captain Blackbeard who was believed dead. He must now lay the pirate to rest and save a local hotel from mobster Silky Seymour, who wants to build a casino.",10900000.0,https://m.media-amazon.com/images/M/MV5BZTU3NzZlMzItY2YwMC00NWY0LWEwMGQtYjgyZmRjOGFjYjRkXkEyXkFqcGc@._V1_SX300.jpg,106.0,71.0,2035,Blackbeard's Ghost (1968),1968.0,success
tt0109287,Rupert Wainwright,"After a bike accident, a young boy inadvertently gains possession of a check for $1 million and proceeds to spend it, unaware that the gangsters it belongs to are in pursuit.",30577969.0,https://m.media-amazon.com/images/M/MV5BYWIwMzg5YzctY2MyNS00MDIxLTk5MTktOTk0YzJmZGRmNGJkXkEyXkFqcGc@._V1_SX300.jpg,93.0,42.0,2036,Blank Check (1994),1994.0,success
tt0075807,Norman Tokar,"Welcome to Candleshoe, a stately English manor where a swashbuckling pirate hid a fortune in Spanish doubloons centuries ago. And that's what young orphan Casey and a sly con man are determined to find.",,https://m.media-amazon.com/images/M/MV5BZDY2ZmVjNjYtMDg2NC00ZmM2LWE1YmMtZDEzZjRiMTJlNjQ2XkEyXkFqcGc@._V1_SX300.jpg,101.0,68.0,2037,Candleshoe (1977),1977.0,success
tt0082199,Charles Jarrott,Cartoonist Woody becomes the superhero he draws. Using his gadgets he helps a Soviet spy defect to the West.,,https://m.media-amazon.com/images/M/MV5BNDJkMmQwMjgtNDI4Ni00NTZjLTg5MzQtZjAxMzYyZDM2MTczXkEyXkFqcGc@._V1_SX300.jpg,90.0,46.0,2041,Condorman (1981),1981.0,success
tt0109520,Sam Weisman,Can Gordon's team win the Junior Goodwill Games in California in spite of all the set-backs?,45610410.0,https://m.media-amazon.com/images/M/MV5BNWM2ZmUwOTEtZjZjYy00NDRjLWJkNWEtMTExNGIzZjIxNzgzXkEyXkFqcGc@._V1_SX300.jpg,106.0,,2042,D2: The Mighty Ducks (1994),1994.0,success
tt0052722,Robert Stevenson,A wily old codger matches wits with the King of the Leprechauns and helps play matchmaker for his daughter and the strapping lad who has replaced him as caretaker.,,https://m.media-amazon.com/images/M/MV5BMTJmYjM1M2YtMWI0NC00MzVlLWE2ZTMtZTdhYjZlYTkzY2UzXkEyXkFqcGc@._V1_SX300.jpg,93.0,80.0,2043,Darby O'Gill and the Little People (1959),1959.0,success
tt0091059,Randal Kleiser,"In 1978, a boy travels eight years into the future and has an adventure with an intelligent, wisecracking alien ship.",18564613.0,https://m.media-amazon.com/images/M/MV5BZTJhYTMyNDMtMjAyYy00YTRkLWJmZGMtMDZlODc0NWZmZDRhXkEyXkFqcGc@._V1_SX300.jpg,90.0,64.0,2046,Flight of the Navigator (1986),1986.0,success
tt0080861,Vincent McEveety,The adorable little VW helps its owners break up a counterfeiting ring in Mexico.,18000000.0,https://m.media-amazon.com/images/M/MV5BZjIyN2ViMTItMTE1ZS00ZDgzLWIzMzYtZmUyY2VjYjU5ZThhXkEyXkFqcGc@._V1_SX300.jpg,100.0,55.0,2050,Herbie Goes Bananas (1980),1980.0,success
tt0076137,Vincent McEveety,"Herbie, the Volkswagen Beetle with a mind of its own, is racing in the Monte Carlo Rally. Unbeknownst to Herbie's driver, thieves have hidden a stolen diamond in Herbie's gas tank, and are now trying to get it back.",29000000.0,https://m.media-amazon.com/images/M/MV5BNmJkYjg0NzctYmE5NC00MzFiLWI2N2MtOWRlMGI4NTU3NWJkXkEyXkFqcGc@._V1_SX300.jpg,105.0,38.0,2051,Herbie Goes to Monte Carlo (1977),1977.0,success
tt0107120,Kenny Ortega,"A teenage boy named Max and his little sister move to Salem, where he struggles to fit in before awakening a trio of diabolical witches that were executed in the 17th century.",46194549.0,https://m.media-amazon.com/images/M/MV5BYWRhOThjM2UtNmRhMi00YzFiLWI4MDYtOGQwNGY0ZjFlOGFkXkEyXkFqcGc@._V1_SX300.jpg,96.0,43.0,2052,Hocus Pocus (1993),1993.0,success
tt0104437,Randal Kleiser,"The Szalinski family is back, this time hilarious disaster strikes when an experiment causes their new toddler son to grow many stories tall.",58662452.0,https://m.media-amazon.com/images/M/MV5BYWU1ZmYxZmItY2ExMi00NTAwLThhMDItMzhmZGFjN2JlNjRiXkEyXkFqcGc@._V1_SX300.jpg,89.0,50.0,2053,"Honey, I Blew Up the Kid (1992)",1992.0,success
tt0097523,Joe Johnston,The scientist father of a teenage girl and boy accidentally shrinks his and two other neighborhood teens to the size of insects. Now the teens must fight diminutive dangers as the father searches for them.,130724172.0,https://m.media-amazon.com/images/M/MV5BMWZmMDA5OGUtNmUzZi00MTkyLWE2MTctNmRkOWUwMWViNjNkXkEyXkFqcGc@._V1_SX300.jpg,93.0,63.0,2054,"Honey, I Shrunk the Kids (1989)",1989.0,success
tt0077698,Robert Butler,This saga of the old west involves twin brothers who compete for possession of a rickety cow town founded by their father while a crooked Mayor tries to put an end to the competitors so he can inherit the town himself.,,https://m.media-amazon.com/images/M/MV5BZmUwMDM4ZmQtNjgxMi00ZTA2LTllZGEtOTY3YTlmODJiNmQ2XkEyXkFqcGc@._V1_SX300.jpg,90.0,,2055,Hot Lead and Cold Feet (1978),1978.0,success
tt0056095,Robert Stevenson,"In 19th century England, young Mary Grant and her brother, Robert, embark on a dangerous quest to find their missing father, a sea captain who vanished somewhere along the Chilean coast.",21745500.0,https://m.media-amazon.com/images/M/MV5BZmExZGJhM2YtMmQ1Mi00YjIwLWFhZDUtMTFhZWZjZTNhYTYxXkEyXkFqcGc@._V1_SX300.jpg,98.0,,2056,In Search of the Castaways (1962),1962.0,success
tt0131857,David Zucker,"Two childhood friends are pro athletes of a national sport called BASEketball, a hybrid of baseball and basketball, and must deal with a greedy businessman scheming against their team.",7027290.0,https://m.media-amazon.com/images/M/MV5BYzA0ZWY2MDEtMzczMC00NjkyLThmYjItMDk4ZDRmMDE4MjJmXkEyXkFqcGc@._V1_SX300.jpg,103.0,38.0,2060,BASEketball (1998),1998.0,success
tt0098213,Michael Moore,"After General Motors closes its factory in Flint, Michigan, eliminating 35,000 jobs, filmmaker Michael Moore undertakes a quixotic quest to interview General Motors' chairman, Roger B. Smith.",6706368.0,https://m.media-amazon.com/images/M/MV5BZTVmZGRiODctNTI5OS00YzIwLTgxMGMtYjAxNjMyZGNmNzQwXkEyXkFqcGc@._V1_SX300.jpg,91.0,70.0,2064,Roger & Me (1989),1989.0,success
tt0039689,Jacques Tourneur,"A private eye escapes his past to run a gas station in a small town, but his past catches up with him. Now he must return to the big city world of danger, corruption, double crosses, and duplicitous dames.",,https://m.media-amazon.com/images/M/MV5BOWM3MjAzN2MtOTE0OS00ZTIxLWFkZTAtZTVmNmMyNGZjNDA4XkEyXkFqcGc@._V1_SX300.jpg,97.0,85.0,2066,Out of the Past (1947),1947.0,success
tt0059113,David Lean,"The life of a Russian physician and poet who, although married to another, falls in love with a political activist's wife and experiences hardship during World War I and then the October Revolution.",111721910.0,https://m.media-amazon.com/images/M/MV5BNWQyZGNmZWItNjc0OS00M2YyLWJkZmYtZWNlNDE2MzMwYzUzXkEyXkFqcGc@._V1_SX300.jpg,197.0,69.0,2067,Doctor Zhivago (1965),1965.0,success
tt0086423,Bruce Beresford,"A broken-down, middle-aged country singer gets a new wife, reaches out to his long-lost daughter, and tries to put his troubled life back together.",8443124.0,https://m.media-amazon.com/images/M/MV5BY2FkNDgyN2MtMDQ2YS00NTM1LWFhNDctNGEyMzBiYmI5NDRhXkEyXkFqcGc@._V1_SX300.jpg,92.0,76.0,2070,Tender Mercies (1983),1983.0,success
tt0106273,Roger Spottiswoode,"The story of the discovery of the AIDS epidemic, and the political infighting of the scientific community hampering the early fight with it.",,https://m.media-amazon.com/images/M/MV5BMjQwOWQ1NDgtMzQzNy00NTFlLWJhNjQtNTUwMGRkZTk3OGIwXkEyXkFqcGc@._V1_SX300.jpg,141.0,,2071,And the Band Played On (1993),1993.0,success
tt0089126,Kevin Reynolds,"Five college buddies from the University of Texas circa 1971 embark on a final road trip odyssey across the Mexican border before facing up to uncertain futures, in Vietnam and otherwise.",91666.0,https://m.media-amazon.com/images/M/MV5BMDNlZDY3YzgtYWMxNy00YjcxLWFhMGEtZWU1ODJlMjE1OGQxXkEyXkFqcGc@._V1_SX300.jpg,91.0,50.0,2073,Fandango (1985),1985.0,success
tt0082736,István Szabó,"In early-1930s Germany, a passionate stage actor faces a dilemma: renounce his apolitical stance and comply with the Reich's doctrine, or face oblivion. But, Faustian bargains never end well. What is the price of success?",,https://m.media-amazon.com/images/M/MV5BNmFmYmIyOGQtZGVkYS00MmJkLWI5ZWYtNDQ2ZjRhYWIwYjZkXkEyXkFqcGc@._V1_SX300.jpg,146.0,,2075,Mephisto (1981),1981.0,success
tt0090756,David Lynch,"The discovery of a severed human ear found in a field leads a young man on an investigation related to a beautiful, mysterious nightclub singer and a group of psychopathic criminals who have kidnapped her child.",8551228.0,https://m.media-amazon.com/images/M/MV5BNzkwZGUyYjQtM2QyOC00MTBjLWE0NGYtMTZmOGM5MjI0Mzg0XkEyXkFqcGc@._V1_SX300.jpg,120.0,75.0,2076,Blue Velvet (1986),1986.0,success
tt0048280,"Clyde Geronimi, Wilfred Jackson, Hamilton Luske",The romantic tale of a sheltered uptown Cocker Spaniel dog and a streetwise downtown Mutt.,93602326.0,https://m.media-amazon.com/images/M/MV5BMjA1NmQ2MTYtNzU0NC00NzBiLWJmZmQtM2FlNDViODk4OWEwXkEyXkFqcGc@._V1_SX300.jpg,76.0,78.0,2080,Lady and the Tramp (1955),1955.0,success
tt0104990,Kenny Ortega,A musical based on the New York City newsboy strike of 1899. When young newspaper sellers are exploited beyond reason by their bosses they set out to enact change and are met by the ruthlessness of big business.,2819485.0,https://m.media-amazon.com/images/M/MV5BYzBjMjgzZTAtNmNkMy00NTM2LWExNTktYTQ5ZGVhMDhhZGVkXkEyXkFqcGc@._V1_SX300.jpg,121.0,46.0,2084,Newsies (1992),1992.0,success
tt0046183,"Clyde Geronimi, Wilfred Jackson, Hamilton Luske","Wendy and her brothers are whisked away to the magical world of Neverland with the hero of their stories, Peter Pan.",87404651.0,https://m.media-amazon.com/images/M/MV5BOGUwNjg5MWItNTc5OC00MTNkLWEwNzYtYzA1M2Y4MWU3NmQwXkEyXkFqcGc@._V1_SX300.jpg,77.0,76.0,2087,Peter Pan (1953),1953.0,success
tt0081353,Robert Altman,The adventures of the famous sailor man and his friends in the seaside town of Sweethaven.,49823037.0,https://m.media-amazon.com/images/M/MV5BOWVlMWUxMmEtOGFlZS00MDJmLWE1NWQtZWI5MGMxZmU2NDIxXkEyXkFqcGc@._V1_SX300.jpg,114.0,64.0,2088,Popeye (1980),1980.0,success
tt0078158,John Hough,"Tia and Tony visit Los Angeles, but he's quickly kidnapped by an evil scientist, leaving her to desperately search for him.",16393000.0,https://m.media-amazon.com/images/M/MV5BN2Y3ZGI0NGEtNTNiNy00MjMwLTg5MGQtYzNjYjFkNzk4MzYyXkEyXkFqcGc@._V1_SX300.jpg,95.0,51.0,2091,Return from Witch Mountain (1978),1978.0,success
tt0089908,Walter Murch,"Dorothy, saved from a psychiatric experiment by a mysterious girl, is somehow called back to Oz when a vain witch and the Nome King destroy everything that makes the magical land beautiful.",11137801.0,https://m.media-amazon.com/images/M/MV5BZWQ5ZTcyNTUtMzA2Yy00NDJmLTk2MGUtOTMxZDVmNjE3NDQ4XkEyXkFqcGc@._V1_SX300.jpg,113.0,42.0,2093,Return to Oz (1985),1985.0,success
tt0053285,"Les Clark, Clyde Geronimi, Eric Larson","After being snubbed by the royal family, a malevolent fairy places a curse on a princess which only a prince can break, along with the help of three good fairies.",51600000.0,https://m.media-amazon.com/images/M/MV5BYjVjNjZkNTQtOTRhZi00NTVhLThkMzktYzY4YjIwZWRhZjA0XkEyXkFqcGc@._V1_SX300.jpg,75.0,85.0,2096,Sleeping Beauty (1959),1959.0,success
tt0086336,Jack Clayton,"In a small American town, a diabolical circus and its demonic proprietor prey on the townsfolk.",8400000.0,https://m.media-amazon.com/images/M/MV5BNWViMzYzZGEtYTI2MC00ZmQyLWIxOTItN2UwNzlkNTQ1ZGFiXkEyXkFqcGc@._V1_SX300.jpg,95.0,68.0,2097,Something Wicked This Way Comes (1983),1983.0,success
tt0038969,"Harve Foster, Wilfred Jackson","The kindly story-teller Uncle Remus tells a young boy stories about trickster Br'er Rabbit, who outwits Br'er Fox and slow-witted Br'er Bear.",37459346.0,https://m.media-amazon.com/images/M/MV5BM2ZhNTczOWYtZWQ0NS00NDRjLWI0MDItOTYwYWI2NTM3NjdjXkEyXkFqcGc@._V1_SX300.jpg,94.0,54.0,2099,Song of the South (1946),1946.0,success
tt0088161,Ron Howard,A young man is reunited with a mermaid he briefly encountered as a boy and falls in love with her without knowing her secret.,69821334.0,https://m.media-amazon.com/images/M/MV5BNGM2NDk4ZTgtYmVkZS00OTE4LTk2ZTAtYzc3Nzk4ZGU3NmE0XkEyXkFqcGc@._V1_SX300.jpg,111.0,71.0,2100,Splash (1984),1984.0,success
tt0019422,"Ub Iwerks, Walt Disney",Mickey Mouse is a mischievous deckhand on a riverboat that is under the command of the tyrannical Captain Pete.,,https://m.media-amazon.com/images/M/MV5BODhlNGQyZTAtNGE0ZS00OWVhLTkzODQtOTBiMmQ2ODZjNzI2XkEyXkFqcGc@._V1_SX300.jpg,8.0,,2102,Steamboat Willie (1928),1928.0,success
tt0111359,Jeremiah S. Chechik,"A young boy's imagination summons cowboy legend Pecos Bill, who helps him save the family farm from a greedy land-grabber. With the help of a lumberjack and a railroad worker, they all embark on a surprise-filled adventure.",8247627.0,https://m.media-amazon.com/images/M/MV5BZTJjYWZlOTMtNTZiZC00MmVmLTg3NzMtODFkMDZhNWExMzA0XkEyXkFqcGc@._V1_SX300.jpg,96.0,,2103,Tall Tale (1995),1995.0,success
tt0084783,Tim Hunter,"After their mother dies and their father leaves them, teenage brothers Tex and Mason McCormick struggle to make it on their own.",7400000.0,https://m.media-amazon.com/images/M/MV5BMDliNjZjYzgtNWExYi00Yzg3LTlmNjQtNGMxNmU0NjQyMTAxXkEyXkFqcGc@._V1_SX300.jpg,103.0,78.0,2104,Tex (1982),1982.0,success
tt0084827,Steven Lisberger,A computer hacker is abducted into a digital world and forced to participate in gladiatorial games where his only chance of escape is with the help of a heroic security program.,33000000.0,https://m.media-amazon.com/images/M/MV5BMTA4Y2VjOWEtMWQ5MS00YWU5LTkxZTMtNzVmMDYyNWFiODU5XkEyXkFqcGc@._V1_SX300.jpg,96.0,58.0,2105,Tron (1982),1982.0,success
tt0108265,Thomas Carter,A group of teens adores forbidden music in Nazi Germany just before the outbreak of World War II.,5632086.0,https://m.media-amazon.com/images/M/MV5BN2VmNDgxM2MtMGU4MC00MWI1LWE4ODEtMTY4ODk1YTA2ODFjXkEyXkFqcGc@._V1_SX300.jpg,112.0,39.0,2106,Swing Kids (1993),1993.0,success
tt0102250,Mick Jackson,"With the help of a talking freeway billboard, a wacky weatherman tries to win the heart of an English newspaper reporter, who is struggling to make sense of the strange world of early 1990s Los Angeles.",28862081.0,https://m.media-amazon.com/images/M/MV5BYmE2MWM5YTEtZmE5ZS00MzdjLWE2NjQtMmJjNGRiNjlhZjc2XkEyXkFqcGc@._V1_SX300.jpg,95.0,66.0,2108,L.A. Story (1991),1991.0,success
tt0083798,Carl Reiner,Film noir parody with a detective uncovering a sinister plot. Characters from classic noir films appear as scenes from various movies interjected into the story.,18196170.0,https://m.media-amazon.com/images/M/MV5BMjhhMmM3OGQtMzg5OC00ZTcwLWFlOTItNDNhYWVkNzg2MGE3XkEyXkFqcGc@._V1_SX300.jpg,88.0,67.0,2110,Dead Men Don't Wear Plaid (1982),1982.0,success
tt0101969,Lawrence Kasdan,The fates of several people are randomly intertwining. Their sympathy of each other faces multiple differences in their lifestyles.,33243020.0,https://m.media-amazon.com/images/M/MV5BODE1MmVkZDUtNzA3ZC00M2E2LWJiZmYtNDk0Y2ZjYzliNDM3XkEyXkFqcGc@._V1_SX300.jpg,134.0,64.0,2112,Grand Canyon (1991),1991.0,success
tt0087469,Steven Spielberg,"In 1935, Indiana Jones is tasked by Indian villagers with reclaiming a sacred stone stolen from them by a secret cult.",179870271.0,https://m.media-amazon.com/images/M/MV5BOGUwZjZiNWQtYzAzZi00NGI5LWE4YmUtN2Y4YWMwY2RlZDkyXkEyXkFqcGc@._V1_SX300.jpg,118.0,57.0,2115,Indiana Jones and the Temple of Doom (1984),1984.0,success
tt0091499,Stephen King,A group of people try to survive when machines start to come alive and become homicidal.,7433663.0,https://m.media-amazon.com/images/M/MV5BN2UzZDlhN2MtNjVhMi00MWZhLThjNTEtZTg0NDc1NjVkZDQ1XkEyXkFqcGc@._V1_SX300.jpg,98.0,24.0,2119,Maximum Overdrive (1986),1986.0,success
tt0107665,Fraser C. Heston,"A mysterious new shop opens in a small town which always seems to stock the deepest desires of each shopper, with a price far heavier than expected.",15185672.0,https://m.media-amazon.com/images/M/MV5BNTVkYjA1OTQtMDE1OC00ZTU4LTlkNjgtMTgyMGRjOGNjYmYyXkEyXkFqcGc@._V1_SX300.jpg,121.0,43.0,2120,Needful Things (1993),1993.0,success
tt0085382,Lewis Teague,"Cujo, a friendly St. Bernard, contracts rabies and conducts a reign of terror on a small American town.",21156152.0,https://m.media-amazon.com/images/M/MV5BMjM2NDc1NDYtMzA1ZS00NGIwLTljMDAtN2JiNGU2ZDM0MDM3XkEyXkFqcGc@._V1_SX300.jpg,93.0,57.0,2121,Cujo (1983),1983.0,success
tt0087050,Fritz Kiersch,A young couple is trapped in a remote town where a dangerous religious cult of children believes that everyone over age 18 must be killed.,14568989.0,https://m.media-amazon.com/images/M/MV5BNjFmZjhkNDYtZThjZi00YWY4LWFkYjMtNDM3YjkyODMxZDNmXkEyXkFqcGc@._V1_SX300.jpg,92.0,45.0,2122,Children of the Corn (1984),1984.0,success
tt0096787,"Don Bluth, Gary Goldman, Dan Kuenster","A canine angel, Charlie, sneaks back to earth from heaven but ends up befriending an orphan girl who can speak to animals. In the process, Charlie learns that friendship is the most heavenly gift of all.",27100027.0,https://m.media-amazon.com/images/M/MV5BM2MzNmY2ZWEtMjNiYS00N2FkLTk2NmMtNjI5Mjc1ZDZhNGMxXkEyXkFqcGc@._V1_SX300.jpg,84.0,50.0,2123,All Dogs Go to Heaven (1989),1989.0,success
tt0120631,Andy Tennant,"The Brothers Grimm arrive at the home of a wealthy Grande Dame who speaks of the many legends surrounding the fable of the cinder girl before telling the ""true"" story of her ancestor.",65705771.0,https://m.media-amazon.com/images/M/MV5BMTYyMDJjZTgtZGRjNS00MmY5LTg4YWUtYjc0NTdlY2U2NWYxXkEyXkFqcGc@._V1_SX300.jpg,121.0,66.0,2125,Ever After: A Cinderella Story (1998),1998.0,success
tt0120832,Brian De Palma,Corrupt Atlantic City police officer Rick Santoro and Navy Commander Kevin Dunn join forces to investigate both the assassination of Secretary of Defense Charles Kirkland and the disappearance of a beautiful stranger.,55591409.0,https://m.media-amazon.com/images/M/MV5BMWFhNWFhOTktZmY2ZS00OTAyLTg5MWMtYTY1OTkxYWMxMDRiXkEyXkFqcGc@._V1_SX300.jpg,98.0,52.0,2126,Snake Eyes (1998),1998.0,success
tt0080388,Louis Malle,"In a corrupt city, a small-time gangster and the estranged wife of a pot dealer find themselves thrown together in an escapade of love, money, drugs and danger.",12729675.0,https://m.media-amazon.com/images/M/MV5BMzY3Mzc5YmEtMGYwNS00YjJkLWE2NjQtOWNiM2RlNWFhMTY1XkEyXkFqcGc@._V1_SX300.jpg,104.0,85.0,2130,Atlantic City (1980),1980.0,success
tt0061184,Mike Nichols,"A middle-aged New England associate professor and his wife, with the help of alcohol, use their young guests to fuel anguish and emotional pain towards each other over the course of a distressing night.",28000000.0,https://m.media-amazon.com/images/M/MV5BOGY5YWJlMjUtNWI4Zi00NTExLWIwMDUtNGJkOTM0MzliNjE4XkEyXkFqcGc@._V1_SX300.jpg,131.0,75.0,2132,Who's Afraid of Virginia Woolf? (1966),1966.0,success
tt0092513,Chris Columbus,A babysitter must battle her way through the big city after being stranded there with the kids she's looking after.,34368475.0,https://m.media-amazon.com/images/M/MV5BOWRlODFjMTMtNDBiNS00Y2E0LWEzMDMtYjI3NjAzMDg1N2RlXkEyXkFqcGc@._V1_SX300.jpg,102.0,45.0,2133,Adventures in Babysitting (1987),1987.0,success
tt0090305,John Hughes,"Two high-school nerds use a computer program to literally create the perfect woman, who promptly turns their lives upside-down.",23834048.0,https://m.media-amazon.com/images/M/MV5BYjI2N2Q4ZjEtZjMyNC00MDM5LTkxZTQtNzA4MTE1ZGQyYTgwXkEyXkFqcGc@._V1_SX300.jpg,94.0,46.0,2134,Weird Science (1985),1985.0,success
tt0061584,Richard Fleischer,"After the animal communicating veterinarian goes too far for his clientele, he and his friends escape their hometown to the sea in search of the Great Pink Sea Snail.",,https://m.media-amazon.com/images/M/MV5BMjMxOTM3NzU4M15BMl5BanBnXkFtZTgwNDU0MDUxMDE@._V1_SX300.jpg,152.0,34.0,2135,Doctor Dolittle (1967),1967.0,success
tt0070016,"Charles Nichols, Iwao Takamoto","Wilbur is a farm pig who's terrified that he'll end up on the dinner table. His friend Charlotte, a charming spider, comes to his rescue. She weaves words into her web, convincing the farmer that Wilbur is too special a pig to kill.",5232000.0,https://m.media-amazon.com/images/M/MV5BZjhlYjU1NmEtZWZmNy00ZWZiLWJjZjktZmM3MjczOWE5MjIyXkEyXkFqcGc@._V1_SX300.jpg,94.0,73.0,2137,Charlotte's Web (1973),1973.0,success
tt0078480,"Martin Rosen, John Hubley","Hoping to escape destruction by human developers and save their community, a colony of rabbits, led by Hazel and Fiver, seek out a safe place to set up a new warren.",,https://m.media-amazon.com/images/M/MV5BMTM5MTYzMTItYjJhZi00ZDQxLWI3NzYtMjQ2ZWVlYjVlMjMzXkEyXkFqcGc@._V1_SX300.jpg,92.0,64.0,2138,Watership Down (1978),1978.0,success
tt0089469,Ridley Scott,A young man must stop the Lord of Darkness from destroying daylight and marrying the woman he loves.,15502112.0,https://m.media-amazon.com/images/M/MV5BYTc0MGI5MmItZGIwOS00NGZmLWJjZWUtMjAxYzFkOTJkNWVmXkEyXkFqcGc@._V1_SX300.jpg,94.0,30.0,2143,Legend (1985),1985.0,success
tt0088128,John Hughes,"A girl's ""sweet"" sixteenth birthday is anything but special: her family forgets about it, and she suffers from every embarrassment possible.",23686027.0,https://m.media-amazon.com/images/M/MV5BMTgzNTkxMTkxMl5BMl5BanBnXkFtZTgwMjE3NjkzMTE@._V1_SX300.jpg,93.0,61.0,2144,Sixteen Candles (1984),1984.0,success
tt0091790,Howard Deutch,A poor girl must choose between the affections of dating her childhood sweetheart or a rich but sensitive playboy.,40471663.0,https://m.media-amazon.com/images/M/MV5BZWMxMTk4YTAtMzEzNS00OTA0LTk2NWMtZjhjYmQwNDUyMzkzXkEyXkFqcGc@._V1_SX300.jpg,97.0,56.0,2145,Pretty in Pink (1986),1986.0,success
tt0090060,Joel Schumacher,"A group of friends, just out of college, struggle with adulthood.",37803872.0,https://m.media-amazon.com/images/M/MV5BNDU2ODMyNDctOGNlMC00OGJmLTg3MDgtZTYzZGMwMTBiYWM1XkEyXkFqcGc@._V1_SX300.jpg,110.0,35.0,2146,St. Elmo's Fire (1985),1985.0,success
tt0091990,Carol Frank,A female college student who recently moved into a sorority is hunted by an escaped psychotic killer who shares a strange telepathic link with her.,,https://m.media-amazon.com/images/M/MV5BZDQ1ODFjNjMtYTYyZS00ODI5LWI5NzAtMTQ3NmRiYjUzNTRmXkEyXkFqcGc@._V1_SX300.jpg,74.0,,2148,House (1986),1986.0,success
tt0093220,Ethan Wiley,The new owner of a sinister house gets involved with reanimated corpses and demons searching for an ancient Aztec skull with magic powers.,7800000.0,https://m.media-amazon.com/images/M/MV5BMzJiMjVlMGYtMzJhZS00OWEwLTg4MzQtNTE3NWEyNWRkNmQwXkEyXkFqcGc@._V1_SX300.jpg,88.0,31.0,2149,House II: The Second Story (1987),1987.0,success
tt0140796,Richard Martin,Story of a golden retriever who can play football.,10224116.0,https://m.media-amazon.com/images/M/MV5BNjcxMzQ2NDM0NF5BMl5BanBnXkFtZTgwOTI4OTY4ODE@._V1_SX300.jpg,90.0,,2152,Air Bud: Golden Receiver (1998),1998.0,success
tt1350478,Clyde Lucas,"A Journey Back to the classic Avengers TV Series. I directed and produced. It was an honor to directed Patrick Macnee. He was such a gentleman. To film Live in London all the ladies: Honor Blackman, Dame Diana Rigg. Linda Thorson ...",,https://m.media-amazon.com/images/M/MV5BMzcxYmVkODQtZTgyOS00YWFkLTg1MjMtZTQyNmRjNWQ0M2M1XkEyXkFqcGc@._V1_SX300.jpg,,,2153,"Avengers, The (1998)",1998.0,success
tt0120703,Kevin Rodney Sullivan,"Stella is a highly successful, forty-something San Francisco stock broker who is persuaded by her colorful New York girlfriend Delilah to take a well deserved, first-class vacation to Jamaica.",37672941.0,https://m.media-amazon.com/images/M/MV5BOTg5Yzk0NjItZTBkZS00NTc4LTgwZGMtYWU3YTYzNjZlYTEwXkEyXkFqcGc@._V1_SX300.jpg,124.0,56.0,2154,How Stella Got Her Groove Back (1998),1998.0,success
tt0099763,John McNaughton,"Arriving in Chicago, Henry moves in with ex-con acquaintance Otis and starts schooling him in the ways of the serial killer.",609939.0,https://m.media-amazon.com/images/M/MV5BOGJjMzI2MmQtZTJmYS00OGI0LWE2MDktYWJmNmU0NTMxMjJkXkEyXkFqcGc@._V1_SX300.jpg,83.0,80.0,2159,Henry: Portrait of a Serial Killer (1986),1986.0,success
tt0063522,Roman Polanski,"A young couple trying for a baby moves into an aging, ornate apartment building on Central Park West, where they find themselves surrounded by peculiar neighbors.",,https://m.media-amazon.com/images/M/MV5BNDlhMDI3OTQtNTBkYy00NWQ5LWJmNWEtZGQwYzZlMTQ4MDI1XkEyXkFqcGc@._V1_SX300.jpg,137.0,96.0,2160,Rosemary's Baby (1968),1968.0,success
tt0080391,John De Bello,A group of scientists band together to save the world from mutated killer tomatoes.,,https://m.media-amazon.com/images/M/MV5BMDE3Y2UxOWMtM2RkNC00ZjY1LTgyY2MtZDQwYzFhOWIxNDcxXkEyXkFqcGc@._V1_SX300.jpg,83.0,9.0,2163,Attack of the Killer Tomatoes! (1978),1978.0,success
