imdb_id,director,plot,box_office,poster_url,runtime_minutes,metascore,movieId,title,release_year,status
,,,,,,,1198,Raiders of the Lost Ark (Indiana Jones and the Raiders of the Lost Ark) (1981),1981.0,failed
,,,,,,,1201,"Good, the Bad and the Ugly, The (Buono, il brutto, il cattivo, Il) (1966)",1966.0,failed
,,,,,,,1202,Withnail & I (1987),1987.0,failed
,,,,,,,1206,"Clockwork Orange, A (1971)",1971.0,failed
,,,,,,,1209,Once Upon a Time in the West (C'era una volta il West) (1968),1968.0,failed
,,,,,,,1211,"Wings of Desire (Himmel über Berlin, Der) (1987)",1987.0,failed
,,,,,,,1212,"Third Man, The (1949)",1949.0,failed
,,,,,,,1216,"Big Blue, The (Grand bleu, Le) (1988)",1988.0,failed
,,,,,,,1218,"Killer, The (Die xue shuang xiong) (1989)",1989.0,failed
,,,,,,,1220,"Blues Brothers, The (1980)",1980.0,failed
,,,,,,,1221,"Godfather: Part II, The (1974)",1974.0,failed
,,,,,,,1223,"Grand Day Out with Wallace and Gromit, A (1989)",1989.0,failed
,,,,,,,1226,"Quiet Man, The (1952)",1952.0,failed
,,,,,,,1231,"Right Stuff, The (1983)",1983.0,failed
,,,,,,,1233,"Boot, Das (Boat, The) (1981)",1981.0,failed
,,,,,,,1234,"Sting, The (1973)",1973.0,failed
,,,,,,,1237,"Seventh Seal, The (Sjunde inseglet, Det) (1957)",1957.0,failed
,,,,,,,1240,"Terminator, The (1984)",1984.0,failed
,,,,,,,1241,Dead Alive (Braindead) (1992),1992.0,failed
,,,,,,,1243,Rosencrantz and Guildenstern Are Dead (1990),1990.0,failed
,,,,,,,1247,"Graduate, The (1967)",1967.0,failed
,,,,,,,1249,"Femme Nikita, La (Nikita) (1990)",1990.0,failed
,,,,,,,1250,"Bridge on the River Kwai, The (1957)",1957.0,failed
,,,,,,,1251,8 1/2 (8½) (1963),1963.0,failed
,,,,,,,1253,"Day the Earth Stood Still, The (1951)",1951.0,failed
,,,,,,,1254,"Treasure of the Sierra Madre, The (1948)",1948.0,failed
,,,,,,,1258,"Shining, The (1980)",1980.0,failed
,,,,,,,1262,"Great Escape, The (1963)",1963.0,failed
,,,,,,,1263,"Deer Hunter, The (1978)",1978.0,failed
,,,,,,,1267,"Manchurian Candidate, The (1962)",1962.0,failed
,,,,,,,1280,Raise the Red Lantern (Da hong deng long gao gao gua) (1991),1991.0,failed
,,,,,,,1281,"Great Dictator, The (1940)",1940.0,failed
,,,,,,,1284,"Big Sleep, The (1946)",1946.0,failed
,,,,,,,1289,Koyaanisqatsi (a.k.a. Koyaanisqatsi: Life Out of Balance) (1983),1983.0,failed
,,,,,,,1295,"Unbearable Lightness of Being, The (1988)",1988.0,failed
,,,,,,,1296,"Room with a View, A (1986)",1986.0,failed
,,,,,,,1299,"Killing Fields, The (1984)",1984.0,failed
,,,,,,,1300,My Life as a Dog (Mitt liv som hund) (1985),1985.0,failed
tt0097351,Phil Alden Robinson,"Iowa farmer Ray Kinsella is inspired by a voice he can't ignore to pursue a dream he can hardly believe. Supported by his wife, Ray begins the quest by turning his ordinary cornfield into a place where dreams can come true.",64532235.0,https://m.media-amazon.com/images/M/MV5BZTEwMGYzNDktOWEyMi00NTJjLWE5MGQtNmNlNDkxOTYyZDA5XkEyXkFqcGc@._V1_SX300.jpg,107.0,57.0,1302,Field of Dreams (1989),1989.0,success
tt0064115,George Roy Hill,"In 1890s Wyoming, Butch Cassidy and The Sundance Kid lead a band of outlaws. When a train robbery goes wrong, they find themselves on the run with a posse hard on their heels..",102308889.0,https://m.media-amazon.com/images/M/MV5BMTkyMTM2NDk5Nl5BMl5BanBnXkFtZTgwNzY1NzEyMDE@._V1_SX300.jpg,110.0,66.0,1304,Butch Cassidy and the Sundance Kid (1969),1969.0,success
tt0087884,Wim Wenders,"Travis Henderson, an aimless drifter who has been missing for four years, wanders out of the desert and must reconnect with society, himself, his life, and his family.",2422082.0,https://m.media-amazon.com/images/M/MV5BYWY5YzE4YmUtZWFhMS00YjYxLWI5ZGUtNDEyNmMzNDVjMGEwXkEyXkFqcGc@._V1_SX300.jpg,145.0,81.0,1305,"Paris, Texas (1984)",1984.0,success
tt0098635,Rob Reiner,"Harry and Sally have known each other for years, and are very good friends, but they fear sex would ruin the friendship.",93117425.0,https://m.media-amazon.com/images/M/MV5BMjE0ODEwNjM2NF5BMl5BanBnXkFtZTcwMjU2Mzg3NA@@._V1_SX300.jpg,95.0,76.0,1307,When Harry Met Sally... (1989),1989.0,success
tt0116589,Doug Pray,"Documentary covering the growth and subsequent overexposure of the Seattle ""grunge"" music scene in the early 90s",268520.0,https://m.media-amazon.com/images/M/MV5BNGZjYmRlNWYtYjBiMC00OGJkLTgyNDAtYTEwZWNmY2Q5ZTRkXkEyXkFqcGc@._V1_SX300.jpg,84.0,,1310,Hype! (1996),1996.0,success
tt0116293,Susan Streitfeld,"An ambitious female attorney wallows in excess and meaningless sex with both male and female partners, while dealing with her personal life problems including helping her kleptomaniac sister.",926954.0,https://m.media-amazon.com/images/M/MV5BNDJjZTBkN2UtMTU1Ni00NjQ1LWJiNzItNDY2MTkxZDIzNjU0XkEyXkFqcGc@._V1_SX300.jpg,120.0,,1312,Female Perversions (1996),1996.0,success
tt0112537,Carl Prechezer,"JC thinks surfing is everything. His girlfriend Chloe wants him to settle down. When he decides to go surfing one night with friends from London, she throws JC out. Surfing or Chloe?",4535.0,https://m.media-amazon.com/images/M/MV5BMmNjNzM4NDQtNjQ4MS00NzAzLTkzOTYtOTFiMTg0OGNiZjI0XkEyXkFqcGc@._V1_SX300.jpg,90.0,64.0,1318,Blue Juice (1995),1995.0,success
tt0103678,Tony Randel,"An architect brings home a mysterious old clock, not knowing that it's haunted by the demonic presence of the Amityville house. Soon, the clock begins to alter time and space and starts to possess members of the household.",,https://m.media-amazon.com/images/M/MV5BNTdjMWU5NjUtOTA2NS00NmYwLTgxOTAtZmU0MTlhZTViMWEyXkEyXkFqcGdeQXVyMTk5MjAyMjM@._V1_SX300.jpg,95.0,,1322,Amityville 1992: It's About Time (1992),1992.0,success
tt0115535,Steve White,"A children's doll house, which is a miniature of the infamous haunted Long Island house, is given to a young girl where the demonic evil soon comes out to cause more terror.",,https://m.media-amazon.com/images/M/MV5BYzEzYjUzNGItOGU3Zi00ZDQ1LWI2NTktNzRmMzAxN2NhODBjXkEyXkFqcGdeQXVyMTk5MjAyMjM@._V1_SX300.jpg,93.0,,1324,Amityville: Dollhouse (1996),1996.0,success
tt0106262,John Murlowski,"An old mirror from the Amityville house finds its way into a young photographer's home, where the demonic presence soon manifests itself to cause more death and mayhem.",,https://m.media-amazon.com/images/M/MV5BNDJkYTBlNDAtYjVmMy00YzhiLTljMjItZGI2ZDY3NjJlMzAyXkEyXkFqcGdeQXVyNTM3MDMyMDQ@._V1_SX300.jpg,91.0,,1325,Amityville: A New Generation (1993),1993.0,success
tt0083550,Damiano Damiani,"A dysfunctional family moves into a new house, which proves to be satanic, resulting in the demonic possession of their teenage son.",12534817.0,https://m.media-amazon.com/images/M/MV5BMTYwMTAyOTY4OF5BMl5BanBnXkFtZTcwNjMwODQ2NA@@._V1_SX300.jpg,104.0,34.0,1326,Amityville II: The Possession (1982),1982.0,success
tt0090655,Fred Walton,"Nine college students staying at a friend's remote island mansion begin to fall victim to an unseen murderer over the April Fool's Day weekend, but nothing is as it seems.",12947763.0,https://m.media-amazon.com/images/M/MV5BYjY0MTYxN2QtMjEwYy00MzRjLWIyZmYtYjczNjU5NDAwMWEzXkEyXkFqcGc@._V1_SX300.jpg,89.0,49.0,1330,April Fool's Day (1986),1986.0,success
tt0075704,Robert Wise,A stranger attempts to convince a happily married couple that their daughter is actually his daughter reincarnated.,,https://m.media-amazon.com/images/M/MV5BMGUzODljNmQtODg0My00ZTk3LWEwM2ItOGM3NjQ4MzQ1MWNmXkEyXkFqcGc@._V1_SX300.jpg,113.0,,1331,Audrey Rose (1977),1977.0,success
tt14050190,N/A,N/A,,https://m.media-amazon.com/images/M/MV5BY2VmYzMwNTAtZjgzMy00MWIwLWIxNzAtNjdiOWZmZDI2OThkXkEyXkFqcGc@._V1_SX300.jpg,,,1335,Blood Beach (1981),1981.0,success
tt0101492,Eric Red,"After losing his arm in a car accident, a criminal psychologist has it replaced with a limb that belonged to a serial killer.",9188150.0,https://m.media-amazon.com/images/M/MV5BM2U5ZWQ3MDQtZWJmMS00NTBlLTk5NjktMjdmMzUxOGNlZDgxXkEyXkFqcGc@._V1_SX300.jpg,88.0,,1336,Body Parts (1991),1991.0,success
tt0074258,Dan Curtis,A family moves into a large old mansion in the countryside which seems to have a mysterious and sinister power over its new residents.,,https://m.media-amazon.com/images/M/MV5BMjEzNzYzNTc3Nl5BMl5BanBnXkFtZTgwMDUwNTkyMTE@._V1_SX300.jpg,116.0,48.0,1341,Burnt Offerings (1976),1976.0,success
tt0103919,Bernard Rose,"The Candyman, a murderous soul with a hook for a hand, is accidentally summoned to reality by a skeptic grad student researching the monster's myth.",25792310.0,https://m.media-amazon.com/images/M/MV5BMmZhN2NhOTEtMmVhZC00NWM5LWE4ODgtZGUwMDQxOGViNjY4XkEyXkFqcGc@._V1_SX300.jpg,99.0,61.0,1342,Candyman (1992),1992.0,success
tt0101540,Martin Scorsese,"A convicted rapist, released from prison after serving a fourteen-year sentence, stalks the family of the lawyer who originally defended him.",79091969.0,https://m.media-amazon.com/images/M/MV5BNTBkNTYwZTctOTgxYS00ZmIyLTgzNDAtODJhZjg2MDUwNmFlXkEyXkFqcGc@._V1_SX300.jpg,128.0,73.0,1343,Cape Fear (1991),1991.0,success
tt0055824,J. Lee Thompson,A lawyer's family is stalked by a man he once helped put in jail.,,https://m.media-amazon.com/images/M/MV5BZTI0ZDQyMjUtMGY1OC00NTFiLThhYjQtOTg0YTM4NTA2NjUzXkEyXkFqcGc@._V1_SX300.jpg,106.0,76.0,1344,Cape Fear (1962),1962.0,success
tt0074285,Brian De Palma,"Carrie White, a shy, friendless teenage girl who is sheltered by her domineering, religious mother, unleashes her telekinetic powers after being humiliated by her classmates at her senior prom.",33800000.0,https://m.media-amazon.com/images/M/MV5BNjMwMDVlZjYtMWRlZS00OTU1LTlmYTQtOGViNTdmYTE0ZjRlXkEyXkFqcGc@._V1_SX300.jpg,98.0,86.0,1345,Carrie (1976),1976.0,success
tt0083722,Paul Schrader,A woman who was orphaned from a young age finally reunites with her older brother. Matters start to go awry when she slowly discovers the true nature of her family.,7000000.0,https://m.media-amazon.com/images/M/MV5BMzk0MDY3NjQtOGM4ZC00YjQ3LTg4ZTEtZDA3OWJhZWRjMzhmXkEyXkFqcGc@._V1_SX300.jpg,118.0,61.0,1346,Cat People (1982),1982.0,success
tt0115495,Kevin Spacey,Fleeing robbers stumble into a staked-out bar in New Orleans.,339379.0,https://m.media-amazon.com/images/M/MV5BNDUzYTc3ZWMtY2I0Yi00MTBmLThhODAtOWQ3ZWZlOWViZGM1XkEyXkFqcGc@._V1_SX300.jpg,94.0,48.0,1352,Albino Alligator (1996),1996.0,success
tt0115751,Lars von Trier,"Oilman Jan is paralyzed in an accident. His wife, who prayed for his return, feels guilty; even more, when Jan urges her to have sex with another.",3803298.0,https://m.media-amazon.com/images/M/MV5BYTdjYjg4MTAtMzU4Ny00ODVkLTlhZDItOThiMDBhODI4MTVhXkEyXkFqcGc@._V1_SX300.jpg,153.0,82.0,1354,Breaking the Waves (1996),1996.0,success
tt0119791,Ole Bornedal,A law student is suspected of serial killings.,1179002.0,https://m.media-amazon.com/images/M/MV5BNTE0YTVlMmEtZmNkYS00OWE2LTgwYWEtOTMwNzNlZjYxYTBmXkEyXkFqcGc@._V1_SX300.jpg,101.0,40.0,1355,Nightwatch (1997),1997.0,success
tt0117731,Jonathan Frakes,The Borg travel back in time intent on preventing Earth's first contact with an alien species. Captain Picard and his crew pursue them to ensure that Zefram Cochrane makes his maiden flight reaching warp speed.,92027888.0,https://m.media-amazon.com/images/M/MV5BZjc0OWE1NDMtNjRmMi00ZDc2LWI2ZmQtNzEwNWU4Nzg4NDA5XkEyXkFqcGc@._V1_SX300.jpg,111.0,70.0,1356,Star Trek: First Contact (1996),1996.0,success
tt0117631,Scott Hicks,"David Helfgott, a gifted pianist, struggles through childhood as his dysfunctional father abuses him and his siblings. Years later, he suffers a mental breakdown but manages to return as a legend.",35892330.0,https://m.media-amazon.com/images/M/MV5BODZlMjRmN2UtZmY1Yi00YjhjLTg4OTAtZmQxNWMwZTY5YjI4XkEyXkFqcGc@._V1_SX300.jpg,105.0,87.0,1357,Shine (1996),1996.0,success
tt0117666,Billy Bob Thornton,"Karl Childers, a simple man hospitalized since his childhood murder of his mother and her lover, is released to start a new life in a small town.",24444121.0,https://m.media-amazon.com/images/M/MV5BNDM5MjhhMDgtMmVmYy00ODNlLWI1OGMtMzAzNmY5OGRmNjk0XkEyXkFqcGc@._V1_SX300.jpg,135.0,85.0,1358,Sling Blade (1996),1996.0,success
tt0116705,Brian Levant,"A father vows to get his son a Turbo Man action figure for Christmas. However, every store is sold out, and he must travel all over town and compete with everybody else in order to find one.",60592389.0,https://m.media-amazon.com/images/M/MV5BNDgzMjQ0YTctZGJhNy00ZjJjLTk5YWMtZmI2YTgwOTJmYWJkXkEyXkFqcGc@._V1_SX300.jpg,89.0,34.0,1359,Jingle All the Way (1996),1996.0,success
tt0117293,"Joe Berlinger, Bruce Sinofsky",A horrific triple child murder leads to an indictment and trial of three nonconformist boys based on questionable evidence.,,https://m.media-amazon.com/images/M/MV5BZmMyNGMyYTktOGRjMi00MTE2LTk0ZjctYWY3MDZjNDMwYjhiXkEyXkFqcGc@._V1_SX300.jpg,150.0,,1361,Paradise Lost: The Child Murders at Robin Hood Hills (1996),1996.0,success
tt0117477,Patrice Leconte,"To get royal backing on a needed drainage project, a poor French lord must learn to play the delicate games of wit at court at Versailles.",1979768.0,https://m.media-amazon.com/images/M/MV5BZDhiZjliZGItNGYxYy00MzY4LTg5ZDgtODVmZTQ1MzE1Njk5XkEyXkFqcGc@._V1_SX300.jpg,102.0,80.0,1365,Ridicule (1996),1996.0,success
tt0115433,Stephen Herek,An evil high-fashion designer plots to steal dalmatian puppies in order to make an extravagant fur coat but creates an extravagant mess instead.,136189294.0,https://m.media-amazon.com/images/M/MV5BOTA5MjAzZWYtZmQxMC00NWE0LWJkNWMtMzczNjg3ZTM1ZGRiXkEyXkFqcGc@._V1_SX300.jpg,103.0,50.0,1367,101 Dalmatians (1996),1996.0,success
tt0099423,Renny Harlin,"John McClane must race against time to save hundreds of lives (including his wife's) when a group of terrorists take control of Washington Dulles Airport's systems, and threaten to crash several planes if their demands are not met.",117540947.0,https://m.media-amazon.com/images/M/MV5BMTA1OGFlZWUtZjE4Yy00MzFmLTlhYjctOGY5ZmZjOWFlOWUwXkEyXkFqcGc@._V1_SX300.jpg,124.0,67.0,1370,Die Hard 2 (1990),1990.0,success
tt0079945,Robert Wise,"When an alien spacecraft of enormous power is spotted approaching Earth, Admiral James T. Kirk resumes command of the overhauled USS Enterprise in order to intercept it.",82604699.0,https://m.media-amazon.com/images/M/MV5BNjcyMmVmMTItNTA3Yy00NGJjLTlmYjQtZWQ3ZjcyNmU5NDQ2XkEyXkFqcGc@._V1_SX300.jpg,143.0,50.0,1371,Star Trek: The Motion Picture (1979),1979.0,success
tt0102975,Nicholas Meyer,"On the eve of retirement, Kirk and McCoy are charged with assassinating the Klingon High Chancellor and imprisoned. The Enterprise crew must help them escape to thwart a conspiracy aimed at sabotaging the last best hope for peace.",74888996.0,https://m.media-amazon.com/images/M/MV5BNDgzYjM5MWQtYTkzNy00OWZlLWEzMDctYjA5MDUyNmJhZjM5XkEyXkFqcGc@._V1_SX300.jpg,110.0,65.0,1372,Star Trek VI: The Undiscovered Country (1991),1991.0,success
tt0098382,William Shatner,Captain Kirk and his crew must deal with Mr. Spock's long-lost half-brother who hijacks the Enterprise for an obsessive search for God at the center of the galaxy.,52210049.0,https://m.media-amazon.com/images/M/MV5BNWEzYmU4ZDYtNWMwMi00YWRmLTg3NDQtMWFhYTI3YWQ2OTQ3XkEyXkFqcGc@._V1_SX300.jpg,107.0,43.0,1373,Star Trek V: The Final Frontier (1989),1989.0,success
tt0084726,Nicholas Meyer,"With the assistance of the Enterprise crew, Admiral Kirk must stop an old nemesis, Khan Noonien Singh, from using the life-generating Genesis Device as the ultimate weapon.",79707906.0,https://m.media-amazon.com/images/M/MV5BOTFkZDY5NWQtMjY4Yy00OThiLTk3YjQtMDdhYTllMTI4MTdiXkEyXkFqcGc@._V1_SX300.jpg,113.0,68.0,1374,Star Trek II: The Wrath of Khan (1982),1982.0,success
tt0088170,Leonard Nimoy,Admiral Kirk and his bridge crew risk their careers stealing the decommissioned U.S.S. Enterprise to return to the restricted Genesis Planet to recover Spock's body.,76471046.0,https://m.media-amazon.com/images/M/MV5BYzNkOTZjMTMtOWYzZS00Yjg2LTgyMzQtMmNjODdkYzM0ZjhmXkEyXkFqcGc@._V1_SX300.jpg,105.0,58.0,1375,Star Trek III: The Search for Spock (1984),1984.0,success
tt0092007,Leonard Nimoy,"To save Earth from an alien probe, Admiral James T. Kirk and his fugitive crew go back in time to San Francisco in 1986 to retrieve the only beings who can communicate with it: humpback whales.",109713132.0,https://m.media-amazon.com/images/M/MV5BYmZlYWYwMzUtMjYzMy00MWI1LTg3MDctOTdjYjA2MDkwNGU5XkEyXkFqcGc@._V1_SX300.jpg,119.0,71.0,1376,Star Trek IV: The Voyage Home (1986),1986.0,success
tt0103776,Tim Burton,"While Batman deals with a deformed man calling himself the Penguin wreaking havoc across Gotham with the help of a cruel businessman, a female employee of the latter becomes the Catwoman with her own vendetta.",162924631.0,https://m.media-amazon.com/images/M/MV5BZTliMDVkYTktZDdlMS00NTAwLWJhNzYtMWIwMDZjN2ViMGFiXkEyXkFqcGc@._V1_SX300.jpg,126.0,68.0,1377,Batman Returns (1992),1992.0,success
tt0096487,Christopher Cain,"A group of young gunmen, led by Billy the Kid, become deputies to avenge the murder of the rancher who became their benefactor. But when Billy takes their authority too far, they become the hunted.",45661556.0,https://m.media-amazon.com/images/M/MV5BMGE5ZjYzMDEtZmQ4ZS00YjczLTk5YWYtNjdkZjY4NmQxNTEyXkEyXkFqcGc@._V1_SX300.jpg,107.0,50.0,1378,Young Guns (1988),1988.0,success
tt0100994,Geoff Murphy,"Billy the Kid and his band of outlaws are pursued across New Mexico territory by Sheriff Pat Garrett, who the young gunslingers must face-off with if they are to reach the safety of the border.",44143410.0,https://m.media-amazon.com/images/M/MV5BNmQxZDExMWUtMTcwNi00OGIwLWI0MzktOGU4MDZhZmFmYzdkXkEyXkFqcGc@._V1_SX300.jpg,104.0,47.0,1379,Young Guns II (1990),1990.0,success
tt0077631,Randal Kleiser,"Good girl Sandy Olsson and greaser Danny Zuko fell in love over the summer. When they unexpectedly discover they're now in the same high school, will they be able to rekindle their romance?",190071103.0,https://m.media-amazon.com/images/M/MV5BNGY0NzE0ZTctN2YzNC00M2IwLWI0OWYtMTAwZWU2NjZhMTQwXkEyXkFqcGc@._V1_SX300.jpg,110.0,70.0,1380,Grease (1978),1978.0,success
tt0084021,Patricia Birch,A British student at a 1960s American high school must prove himself to the leader of a girls' gang whose members can only date greasers.,15171476.0,https://m.media-amazon.com/images/M/MV5BYmMyODA2YjAtMDNhMS00OTFlLThjYjctOTMyODk0OTU1ZWYwXkEyXkFqcGc@._V1_SX300.jpg,115.0,52.0,1381,Grease 2 (1982),1982.0,success
tt0100114,Dwight H. Little,A retired DEA agent is out to hunt down and take out a Jamaican drug posse that has targeted he and his family for murder.,46044396.0,https://m.media-amazon.com/images/M/MV5BN2Q3ZjI4OWItOGYzYi00YThiLTllNTgtMGYxNTg3NmVmYjMxXkEyXkFqcGc@._V1_SX300.jpg,93.0,49.0,1382,Marked for Death (1990),1990.0,success
tt0105690,Andrew Davis,"Ex US Navy Seal turned cook, Casey Ryback, is the only person who can stop a group of terrorists when they seize control of the US battleship The Missouri to obtain it's nuclear warheads.",83563139.0,https://m.media-amazon.com/images/M/MV5BM2I3YjcwZDgtZjc3Yy00NTU1LWE5NzMtNzlkOWE4ZDc2YzE2XkEyXkFqcGc@._V1_SX300.jpg,103.0,58.0,1385,Under Siege (1992),1992.0,success
tt0073195,Steven Spielberg,"When a massive killer shark unleashes chaos on a beach community off Long Island, it's up to the local police chief, a marine biologist, and an old seafarer to hunt the beast down.",280083300.0,https://m.media-amazon.com/images/M/MV5BYjViNDQzNmUtYzkxZi00NTk5LTljMmItYjJlZmZkODIxNjU1XkEyXkFqcGc@._V1_SX300.jpg,124.0,87.0,1387,Jaws (1975),1975.0,success
tt0077766,Jeannot Szwarc,Police chief Brody must protect the citizens of Amity after a second monstrous shark begins terrorizing the waters.,81766007.0,https://m.media-amazon.com/images/M/MV5BMzAxN2Q5Y2UtMDBkZS00MGQwLWIyZDEtYTgyNGRlZmZiNjI2XkEyXkFqcGc@._V1_SX300.jpg,116.0,51.0,1388,Jaws 2 (1978),1978.0,success
tt0085750,Joe Alves,A giant thirty-five-foot shark becomes trapped in a SeaWorld theme park and it's up to the sons of police chief Brody to rescue everyone.,45517055.0,https://m.media-amazon.com/images/M/MV5BYmY3YWZiMTAtZGYyYy00ODc3LTk5NjQtY2RhN2QwNzE2ZGI3XkEyXkFqcGc@._V1_SX300.jpg,99.0,27.0,1389,Jaws 3-D (1983),1983.0,success
tt0117119,Peter Segal,"Two former U. S. Presidents, hated rivals, join forces to expose the current, corrupt President at the risk of their lives.",22313201.0,https://m.media-amazon.com/images/M/MV5BOWYzMzE2OTQtZTNkOS00M2U4LWExYTYtNWE1Yjc3YjJhYjZhXkEyXkFqcGc@._V1_SX300.jpg,101.0,49.0,1390,My Fellow Americans (1996),1996.0,success
tt0116996,Tim Burton,Earth is invaded by Martians with unbeatable weapons and a cruel sense of humor.,37781197.0,https://m.media-amazon.com/images/M/MV5BZjJhNTIxZmQtZjQ3ZC00MTZkLWI2YTItY2Y0ZTdiMmNiNGIyXkEyXkFqcGc@._V1_SX300.jpg,106.0,52.0,1391,Mars Attacks! (1996),1996.0,success
tt0115906,Alexander Payne,"An irresponsible, drug-addicted, recently impregnated woman finds herself in the middle of an abortion debate when both parties attempt to sway her to their respective sides.",285112.0,https://m.media-amazon.com/images/M/MV5BYjhiYWVkZGYtYWVkZC00NDY1LTg4NTgtNzQ0ZjFiZTM4ZWQ2XkEyXkFqcGc@._V1_SX300.jpg,106.0,64.0,1392,Citizen Ruth (1996),1996.0,success
tt0116695,Cameron Crowe,"When a sports agent has a moral epiphany and is fired for expressing it, he decides to put his new philosophy to the test as an independent agent with the only athlete who stays with him and his former colleague.",153952592.0,https://m.media-amazon.com/images/M/MV5BM2E1ZjU1MjctZjU2Yi00MGE1LWI1MDEtYzBlMWJlNDc1NTQxXkEyXkFqcGc@._V1_SX300.jpg,139.0,77.0,1393,Jerry Maguire (1996),1996.0,success
tt0093822,"Joel Coen, Ethan Coen","When a childless couple--an ex-con and an ex-cop--decide to help themselves to one of another family's quintuplets, their lives become more complicated than they anticipated.",22847564.0,https://m.media-amazon.com/images/M/MV5BNWIzMTdmZDgtZTc2NS00MDA1LWFiMmMtYzc5YzY0YTEyZjE5XkEyXkFqcGc@._V1_SX300.jpg,94.0,69.0,1394,Raising Arizona (1987),1987.0,success
tt0094155,Barry Levinson,A minor car accident drives two rival aluminum-siding salesmen to the ridiculous extremes of man versus man in 1963 Baltimore.,25411386.0,https://m.media-amazon.com/images/M/MV5BMDNhZGI2NmQtZThkNy00YzAzLWI0MWItYjNlZmUwZmVlNmRkXkEyXkFqcGc@._V1_SX300.jpg,112.0,75.0,1395,Tin Men (1987),1987.0,success
tt0105435,Phil Alden Robinson,A security pro finds his past returning to haunt him when he and his unique team are tasked with retrieving a particularly important item.,51432691.0,https://m.media-amazon.com/images/M/MV5BMGEwMmZlMjgtNDc0MS00NmY1LTljMzQtMzBmNmE0OWRkNjViXkEyXkFqcGc@._V1_SX300.jpg,126.0,65.0,1396,Sneakers (1992),1992.0,success
tt0115633,Anjelica Huston,A mother and daughter find their lives adversely affected when a new man enters the picture. Will their family ever be what they expect?,,https://m.media-amazon.com/images/M/MV5BODM2ZjQwYTMtMGE5OS00MTEzLTg5MGUtN2U1ZDg4YmQ2MDJhXkEyXkFqcGc@._V1_SX300.jpg,98.0,75.0,1397,Bastard Out of Carolina (1996),1996.0,success
tt0116621,Richard Attenborough,A bitter love story between a talented writer and a gentle nurse.,14481231.0,https://m.media-amazon.com/images/M/MV5BMmQwNDlkYmUtZWY3NC00ZjNkLWE1MzUtM2M0ZmU4NDdiNjMwXkEyXkFqcGc@._V1_SX300.jpg,113.0,,1398,In Love and War (1996),1996.0,success
tt0116999,Jerry Zaks,"After seventeen years, a fiercely independent woman and her rebellious son return home and together they turn the family she left behind upside down.",12803305.0,https://m.media-amazon.com/images/M/MV5BZjQzY2E4NjgtMGMwNC00NGQzLWE0ZDEtYzdkNzExMzViYTE3XkEyXkFqcGc@._V1_SX300.jpg,98.0,67.0,1399,Marvin's Room (1996),1996.0,success
tt0116410,Rob Reiner,A Mississippi district attorney and the widow of Medgar Evers struggle to finally bring a white supremacist to justice for the 1963 murder of the civil rights leader.,13323144.0,https://m.media-amazon.com/images/M/MV5BMmVlMWRlZjctNWM4YS00YTBiLWJhYjMtMmUxMDAzOGI1NWY0XkEyXkFqcGc@._V1_SX300.jpg,130.0,,1401,Ghosts of Mississippi (1996),1996.0,success
tt0115641,"Geoffrey Johnson, Mike Judge, Mike de Seve","Our intrepid adolescent heroes wake up to find their beloved television stolen, and embark on an epic journey across America to recover it, and, who knows, maybe even score.",63118386.0,https://m.media-amazon.com/images/M/MV5BNzA2NjczNmEtYjYxYi00ZjE2LTkzYTctYzhkZDdmMjlkY2FmXkEyXkFqcGc@._V1_SX300.jpg,81.0,64.0,1405,Beavis and Butt-Head Do America (1996),1996.0,success
tt0117571,Wes Craven,A masked killer targets a past victim's daughter.,103046663.0,https://m.media-amazon.com/images/M/MV5BMjA2NjU5MTg5OF5BMl5BanBnXkFtZTgwOTkyMzQxMDE@._V1_SX300.jpg,111.0,66.0,1407,Scream (1996),1996.0,success
tt0117038,Nora Ephron,Two tabloid reporters checking out a report of the Archangel Michael living with an old woman find that it's true. But that's not the only surprise.,95318203.0,https://m.media-amazon.com/images/M/MV5BYjVkZGQ0MzgtNmQyNS00MzI3LWEzZjItNDdhMDk1NjQ3ZDcyXkEyXkFqcGc@._V1_SX300.jpg,105.0,38.0,1409,Michael (1996),1996.0,success
tt0116477,Kenneth Branagh,"Hamlet, Prince of Denmark, returns home to find his father murdered and his mother remarrying the murderer, his uncle. Meanwhile, war is brewing.",4708156.0,https://m.media-amazon.com/images/M/MV5BNGNjM2NkMmItMjg4YS00OWZiLTk4ZTAtMTUzMzhkNTUxZDc5XkEyXkFqcGc@._V1_SX300.jpg,242.0,,1411,Hamlet (1996),1996.0,success
tt0117690,Terry George,"The 1981 hunger strike in an Irish prison, in which I.R.A. prisoner Bobby Sands led a protest against their treatment as criminals rather than as prisoners of war. It focuses on the mothers of two of the strikers, and their struggle.",671437.0,https://m.media-amazon.com/images/M/MV5BNDE0ODJhZWUtODEwMC00Y2VlLWE4M2ItMDVmN2JiN2E1MjVhXkEyXkFqcGc@._V1_SX300.jpg,112.0,,1412,Some Mother's Son (1996),1996.0,success
tt0117091,Albert Brooks,"A neurotic, twice-divorced sci-fi writer moves back in with his mother to solve his personal problems.",19145198.0,https://m.media-amazon.com/images/M/MV5BYzJlZjE5YTQtMmFhNC00NWE2LTlhNzctYWM1M2ZlOGY3YjE5XkEyXkFqcGc@._V1_SX300.jpg,104.0,76.0,1414,Mother (1996),1996.0,success
