imdb_id,director,plot,box_office,poster_url,runtime_minutes,metascore,movieId,title,release_year,status
tt0109120,George Miller,The true story of how a seal named Andre befriended a little girl named Toni and her family in 1962.,16820893.0,https://m.media-amazon.com/images/M/MV5BOWU1ZWVkNTYtMGQ5Zi00OTQ2LWIzMGEtODQ1MGM1MjEyZGY4XkEyXkFqcGc@._V1_SX300.jpg,94.0,,577,Andre (1994),1994.0,success
tt0110892,Michael Austin,"A mysterious young woman speaking a strange language shows up in an English village, where she is taken in by aristocrats who assume she is a foreign princess",3062530.0,https://m.media-amazon.com/images/M/MV5BN2Q2YjZjNGUtZDFjYS00ZGQ1LThlOTQtNzJhYjNjODMzZGMxXkEyXkFqcGc@._V1_SX300.jpg,97.0,,580,Princess Caraboo (1994),1994.0,success
tt0099785,Chris Columbus,"An eight-year-old troublemaker, mistakenly left home alone, must defend his home against a pair of burglars on Christmas Eve.",285761243.0,https://m.media-amazon.com/images/M/MV5BNzNmNmQ2ZDEtMTc1MS00NjNiLThlMGUtZmQxNTg1Nzg5NWMzXkEyXkFqcGc@._V1_SX300.jpg,103.0,63.0,586,Home Alone (1990),1990.0,success
tt0099653,Jerry Zucker,"After a young man is murdered, his spirit stays behind to warn his lover of impending danger, with the help of a reluctant psychic.",217631306.0,https://m.media-amazon.com/images/M/MV5BZjkwOWM2MWMtMWE1YS00MTBlLTg1ODctYTI3M2I0NGIxMGYyXkEyXkFqcGc@._V1_SX300.jpg,126.0,52.0,587,Ghost (1990),1990.0,success
tt0103639,"Ron Clements, John Musker",A kind-hearted street urchin and a power-hungry Grand Vizier vie for a magic lamp that has the power to make their deepest wishes come true.,217350219.0,https://m.media-amazon.com/images/M/MV5BMmQwYWZjZGItYzc0OC00ZDllLTg3NjItOWIyOWYwMDljMjAyXkEyXkFqcGc@._V1_SX300.jpg,90.0,86.0,588,Aladdin (1992),1992.0,success
tt0103064,James Cameron,"A cyborg, identical to the one who failed to kill Sarah Connor, must now protect her ten year old son John from an even more advanced and powerful cyborg.",205881154.0,https://m.media-amazon.com/images/M/MV5BNGMyMGNkMDUtMjc2Ni00NWFlLTgyODEtZTY2MzBiZTg0OWZiXkEyXkFqcGc@._V1_SX300.jpg,137.0,75.0,589,Terminator 2: Judgment Day (1991),1991.0,success
tt0099348,Kevin Costner,A lieutenant assigned to a remote Civil War outpost starts questioning his purpose after making contact with a neighboring Sioux settlement.,184208848.0,https://m.media-amazon.com/images/M/MV5BMTY3OTI5NDczN15BMl5BanBnXkFtZTcwNDA0NDY3Mw@@._V1_SX300.jpg,181.0,72.0,590,Dances with Wolves (1990),1990.0,success
tt0096895,Tim Burton,"The Dark Knight of Gotham City begins his war on crime with his first major enemy being Jack Napier, a criminal who becomes the clownishly homicidal Joker.",251409241.0,https://m.media-amazon.com/images/M/MV5BYzZmZWViM2EtNzhlMi00NzBlLWE0MWEtZDFjMjk3YjIyNTBhXkEyXkFqcGc@._V1_SX300.jpg,126.0,69.0,592,Batman (1989),1989.0,success
tt0029583,"William Cottrell, David Hand, Wilfred Jackson","Exiled into the dangerous forest by her wicked stepmother, a princess is rescued by seven dwarf miners who make her part of their household.",184925486.0,https://m.media-amazon.com/images/M/MV5BMTQwMzE2Mzc4M15BMl5BanBnXkFtZTcwMTE4NTc1Nw@@._V1_SX300.jpg,83.0,96.0,594,Snow White and the Seven Dwarfs (1937),1937.0,success
tt0101414,"Gary Trousdale, Kirk Wise",A prince cursed to spend his days as a hideous monster sets out to regain his humanity by earning a young woman's love.,218967620.0,https://m.media-amazon.com/images/M/MV5BYTY3NDg2YzktYWFjZC00MTExLTlmZDctMGY3MWYzZTlkYTNiXkEyXkFqcGc@._V1_SX300.jpg,84.0,95.0,595,Beauty and the Beast (1991),1991.0,success
tt0032910,"Norman Ferguson, T. Hee, Wilfred Jackson","A living puppet, with the help of a cricket as his conscience, must prove himself worthy to become a real boy.",84254167.0,https://m.media-amazon.com/images/M/MV5BZGU3MTE3NjYtMGU1Zi00NjBmLTg4MzItZjg0OGZmNjZiYjQwXkEyXkFqcGc@._V1_SX300.jpg,88.0,99.0,596,Pinocchio (1940),1940.0,success
tt0100405,Garry Marshall,"A corporate raider hires a hooker to act as a business escort in Beverly Hills, California.",178406268.0,https://m.media-amazon.com/images/M/MV5BNjk2ODQzNDYxNV5BMl5BanBnXkFtZTgwMTcyNDg4NjE@._V1_SX300.jpg,119.0,51.0,597,Pretty Woman (1990),1990.0,success
tt0110395,C.M. Talkington,"A small time crook flees to Mexico to evade the authorities, loan sharks, and his murderous ex-partner with only his fiancé and a trusted Colt .45.",35200.0,https://m.media-amazon.com/images/M/MV5BZDhhNzIwNTUtOTEzMy00OWJlLTg4NmUtZDJlZWNjMWRkYjRhXkEyXkFqcGc@._V1_SX300.jpg,101.0,49.0,600,Love and a .45 (1994),1994.0,success
tt0117247,Michael Hoffman,"The lives of two strangers and their young children unexpectedly intersect on one hectic, stressful day in New York City.",46151454.0,https://m.media-amazon.com/images/M/MV5BNTRiMjllNGMtNDgxMi00ODQ5LWJlZDktOWMyYTNjODM3NWM5XkEyXkFqcGc@._V1_SX300.jpg,108.0,56.0,605,One Fine Day (1996),1996.0,success
tt0112625,Bill Condon,The Candyman arrives in New Orleans and sets his sights on a young woman whose family was ruined by the immortal killer years before.,13940383.0,https://m.media-amazon.com/images/M/MV5BYmU2YjRiMDItZTRiNi00NmVjLTg1YTUtYWJjYzQ3YmU4MmFhXkEyXkFqcGc@._V1_SX300.jpg,95.0,41.0,606,Candyman: Farewell to the Flesh (1995),1995.0,success
tt0116282,"Joel Coen, Ethan Coen",Minnesota car salesman Jerry Lundegaard's inept crime falls apart due to his and his henchmen's bungling and the persistent police work of the quite pregnant Marge Gunderson.,24611975.0,https://m.media-amazon.com/images/M/MV5BNjg4MWE0MjEtODFhNy00MjA5LTg5ODktMzgwNWFmZTAwNjBlXkEyXkFqcGc@._V1_SX300.jpg,98.0,88.0,608,Fargo (1996),1996.0,success
tt0116552,David R. Ellis,"When adventurous pets Chance, Shadow, and Sassy are accidentally separated from their vacationing humans, they're left to fend for themselves on the mean streets of San Francisco, searching for the ""golden bridge"" that will take t...",32772492.0,https://m.media-amazon.com/images/M/MV5BODUxMjZkN2EtMDkyMC00MmQ2LTlhYmYtZTIwODAyOTFmMGRjXkEyXkFqcGc@._V1_SX300.jpg,88.0,,609,Homeward Bound II: Lost in San Francisco (1996),1996.0,success
tt0082509,"Gerald Potterton, John Bruno, John Halas",A glowing green orb that embodies ultimate evil terrorizes a young girl with an anthology of bizarre and fantastic stories.,546545.0,https://m.media-amazon.com/images/M/MV5BMjRkYWE1ZDUtYjg4Ny00YjAwLWJlZDQtZGU4MWE3ZmNmNjdmXkEyXkFqcGc@._V1_SX300.jpg,86.0,51.0,610,Heavy Metal (1981),1981.0,success
tt0116514,Kevin Yagher,"In the 22nd century, a scientist attempts to right the wrong his ancestor created: the puzzle box that opens the gates of Hell and unleashes Pinhead and his Cenobite legions.",9336886.0,https://m.media-amazon.com/images/M/MV5BYWUyYjc0NjMtOWMxNy00NzRkLTkzZGItOGU4NWIyZDllMzI1XkEyXkFqcGc@._V1_SX300.jpg,85.0,21.0,611,Hellraiser: Bloodline (1996),1996.0,success
tt0116684,Franco Zeffirelli,"Jane Eyre, an orphan, is raised in a harsh charity school. She becomes a teacher and is hired as a governess at Thornfield Hall by housekeeper Mrs. Fairfax. The plot revolves around her experiences there.",5200601.0,https://m.media-amazon.com/images/M/MV5BOWU1ODAyNTAtYTRhNC00MzIyLThkNTQtNGVkZTIxMjNkYmU1XkEyXkFqcGc@._V1_SX300.jpg,112.0,,613,Jane Eyre (1996),1996.0,success
tt0118001,Fernando Trueba,A young gallerist is in love with two sisters at the same time. In order to solve the problem he decides to invent his own twin brother.,1141556.0,https://m.media-amazon.com/images/M/MV5BZmJiODIzNTYtYThlNS00MmUxLTgzYjgtMTIzMjU2MGM0MGMyXkEyXkFqcGc@._V1_SX300.jpg,118.0,,618,Two Much (1995),1995.0,success
tt0116165,Bill Couturié,A trained chimpanzee plays third base for a minor-league baseball team.,4422380.0,https://m.media-amazon.com/images/M/MV5BOWQ2ZWQ4ZjAtYzc0Ni00ZDNmLTkwYTAtMTI2MTUxMjZmMDA5XkEyXkFqcGc@._V1_SX300.jpg,94.0,25.0,619,Ed (1996),1996.0,success
tt0117381,Gregory Hoblit,A high-profile murder intrigues a publicity hungry lawyer.,56116183.0,https://m.media-amazon.com/images/M/MV5BZTJlYjM5MTYtZWU3YS00ZDRhLTk1MWEtZGQyODc1ZDU2MWEwXkEyXkFqcGc@._V1_SX300.jpg,129.0,47.0,628,Primal Fear (1996),1996.0,success
tt0115509,"Larry Leker, Paul Sabella","Charlie and Itchy return to Earth to find Gabriel's Horn, but along the way meet up with a young boy named David, who ran away from home.",8620678.0,https://m.media-amazon.com/images/M/MV5BODZmOTI3ZjEtYWUyMy00MjRiLWEwY2UtOWI0OWZkZTcxMDM0XkEyXkFqcGc@._V1_SX300.jpg,82.0,,631,All Dogs Go to Heaven 2 (1996),1996.0,success
tt0112844,Hal Salwen,"A group of friends in New York, working away at their PCs and laptops, keep in touch exclusively by phone and fax; all are too busy to meet face-to-face. By phone, Gale plays matchmaker for Jerry and Barbara who hit it off beautif...",148121.0,https://m.media-amazon.com/images/M/MV5BYzdhN2MwZDctZTY4Zi00MjE3LThhODItN2MzMDBhNjVjZWZlXkEyXkFqcGc@._V1_SX300.jpg,80.0,,633,Denise Calls Up (1995),1995.0,success
tt0114658,Jonathan R. Betuel,"In an alternate futuristic society, a tough female police detective is paired with a talking dinosaur to find the killer of dinosaurs and other prehistoric animals leading them to a mad scientist bent on creating a new Armageddon.",,https://m.media-amazon.com/images/M/MV5BMzQ4NGIwMjItYzhkNC00ZTI0LWI0YWMtYzgxZDE2ZWViYzRiXkEyXkFqcGc@._V1_SX300.jpg,92.0,,634,Theodore Rex (1995),1995.0,success
tt0113122,Todd Verow,"A first person narrative of the exploits of a gay serial killer in deeply disturbing, controversial drama about violence, sexuality, and the imagination. Dennis, the main character, whose lead we follow on this path between what i...",87433.0,https://m.media-amazon.com/images/M/MV5BMTkxMjQzMzMxN15BMl5BanBnXkFtZTcwODc0OTgyMQ@@._V1_SX300.jpg,88.0,,636,Frisk (1995),1995.0,success
tt0117608,Jonathan Lynn,"Sgt. Bilko is a well-liked conman in charge of the army base's motor pool, developing a hover tank and unofficially of gambling etc. One man hates Bilko and he's coming to inspect the base for possible closure.",30356793.0,https://m.media-amazon.com/images/M/MV5BM2NhYzI5ZjYtNTEzNS00MGQ1LTkxMTQtYTc2ZTk2NzQwMWZmXkEyXkFqcGc@._V1_SX300.jpg,94.0,47.0,637,Sgt. Bilko (1996),1996.0,success
tt0116414,Spike Lee,An aspiring actress disappointed by her treatment in the movie industry turns to phone sex to make a living.,4939939.0,https://m.media-amazon.com/images/M/MV5BNDkwNDU4ZDMtZTRhYy00ZGY4LThlMTUtNDQ2ZGE3YWQwM2U4XkEyXkFqcGc@._V1_SX300.jpg,108.0,44.0,639,Girl 6 (1996),1996.0,success
tt0116095,Jeremiah S. Chechik,The wife and mistress of the sadistic dean of an exclusive prep school conspire to murder him.,17100266.0,https://m.media-amazon.com/images/M/MV5BMzRlNjVlNTAtNjQ0Mi00NDhmLTlhMWUtNmIwY2FhNTdkOTc0XkEyXkFqcGc@._V1_SX300.jpg,107.0,,640,Diabolique (1996),1996.0,success
tt0113947,Claude Sautet,"When Nelly, a woman being just divorced, meets by chance M. Arnaud, a mature salesman just retired, begins a strange and special relationship between the two personalities.",955300.0,https://m.media-amazon.com/images/M/MV5BYjM2Y2M4MmMtNTVlMy00YjAwLWE4ZDQtNGUxNjEwYjAwMjlkXkEyXkFqcGc@._V1_SX300.jpg,106.0,,645,Nelly & Monsieur Arnaud (1995),1995.0,success
tt0115956,Edward Zwick,"A U.S. Army officer, despondent about a deadly mistake he made, investigates a female chopper commander's worthiness for the Medal of Honor.",59031057.0,https://m.media-amazon.com/images/M/MV5BZTU2MGZmZjAtOWVjNy00NTlkLTg0ZTUtN2Q3NmUxNTNhNGVhXkEyXkFqcGc@._V1_SX300.jpg,116.0,77.0,647,Courage Under Fire (1996),1996.0,success
tt0117060,Brian De Palma,"An American agent, under false suspicion of disloyalty, must discover and expose the real spy without the help of his organization.",180981856.0,https://m.media-amazon.com/images/M/MV5BOGZjNDlkMTYtMTJkZi00OTkzLWI4NDEtYTA2ODQyMjcwYTdlXkEyXkFqcGc@._V1_SX300.jpg,110.0,59.0,648,Mission: Impossible (1996),1996.0,success
tt0117071,Pen Densham,"The daughter of a thief, young Moll is placed in the care of a nunnery after her mother's execution, but the actions of an abusive priest lead her to rebel as a teenager, and she escapes to the dangerous streets of London. Further...",3486957.0,https://m.media-amazon.com/images/M/MV5BMWM4NjRhN2ItZDAzZi00NDY4LTk5OWMtYjRlZTU1ZGIwYjg2XkEyXkFqcGc@._V1_SX300.jpg,123.0,,650,Moll Flanders (1996),1996.0,success
tt0116136,Rob Cohen,"The last dragon and a disillusioned dragon-slaying knight must unite to stop an evil king, who was granted partial immortality.",51367375.0,https://m.media-amazon.com/images/M/MV5BZDViYjIxNjgtMmEyNS00MmVlLTllOWMtMGU0NzEwZjU2ZTYzXkEyXkFqcGc@._V1_SX300.jpg,103.0,49.0,653,Dragonheart (1996),1996.0,success
tt0116168,Steve Rash,"Coincidences lead to the New York Knicks, getting its loudest fan, Edwina ""Eddie"" Franklin, as coach. Season victory?",31387164.0,https://m.media-amazon.com/images/M/MV5BM2UwZWQ0NWMtMWEzYi00NDk4LTg3MTEtMjM2MGFlNGFhYWUzXkEyXkFqcGc@._V1_SX300.jpg,100.0,,656,Eddie (1996),1996.0,success
tt0116683,Henry Selick,"An orphan who lives with his two cruel aunts befriends anthropomorphic bugs who live inside a giant peach, and they embark on a journey to New York City.",28946127.0,https://m.media-amazon.com/images/M/MV5BMmQwNDEyNjItYmExOC00MGU4LWE2MDEtOTFlZTM5MzA1OTY1XkEyXkFqcGc@._V1_SX300.jpg,79.0,78.0,661,James and the Giant Peach (1996),1996.0,success
tt0116287,James Foley,"When Nicole met handsome, charming, affectionate David, he was everything. It seemed perfect, but soon she sees that David has a darker side. And his adoration turns to obsession, their dream into a nightmare, and her love into fear.",20831000.0,https://m.media-amazon.com/images/M/MV5BMmNiNDEyYjUtN2YzYi00MTBlLWIzNzYtOGM2YWUzNTY4ZDNlXkEyXkFqcGc@._V1_SX300.jpg,97.0,51.0,662,Fear (1996),1996.0,success
tt0116768,Kelly Makin,"A pharmaceutical scientist creates a pill that makes people remember their happiest memory, and although it's successful, it has unfortunate side effects.",2654308.0,https://m.media-amazon.com/images/M/MV5BOWUwODQ3ZTAtMDE5OS00YTFiLTlhMWYtZjYyMTdlYTUyYzQ4XkEyXkFqcGc@._V1_SX300.jpg,89.0,55.0,663,Kids in the Hall: Brain Candy (1996),1996.0,success
tt0114787,Emir Kusturica,"Two underground black marketeers, Marko and Blacky, sell weapons to the Communist resistance in wartime Belgrade, living the good life along the way.",171082.0,https://m.media-amazon.com/images/M/MV5BZGI3MGFhMTgtMDJjOC00ODU1LTlhMTQtZmYyZDQ3YWQxYjc5XkEyXkFqcGc@._V1_SX300.jpg,167.0,79.0,665,Underground (1995),1995.0,success
tt0117128,Jim Mallon,Mike Nelson and his robot companions watch and give their comments about This Island Earth (1955).,1007306.0,https://m.media-amazon.com/images/M/MV5BYmIzYmZlNWMtYTVjNC00YWU5LWI1N2UtZjY2MDVjYTE0YjU0XkEyXkFqcGc@._V1_SX300.jpg,73.0,65.0,671,Mystery Science Theater 3000: The Movie (1996),1996.0,success
tt0117705,Joe Pytka,"In a desperate attempt to win a basketball match and earn their freedom, the Looney Tunes seek the aid of retired basketball champion, Michael Jordan.",90594962.0,https://m.media-amazon.com/images/M/MV5BZGQ3ZDk0M2MtZDNmNi00OWE3LThiODUtMTU3NmVjMTA0ZGQyXkEyXkFqcGc@._V1_SX300.jpg,88.0,57.0,673,Space Jam (1996),1996.0,success
tt0062711,Roger Vadim,"In the 41st century, an astronaut seeks to stop an evil scientist who threatens to unleash a powerful weapon upon the galaxy, partaking in sexy misadventures along the way.",,https://m.media-amazon.com/images/M/MV5BMjExMzcwMjU4OV5BMl5BanBnXkFtZTgwNzYzMjU2MTE@._V1_SX300.jpg,98.0,51.0,674,Barbarella (1968),1968.0,success
tt0113443,Randal Kleiser,"Nick ""Eric Roberts"", is nearing the end of a 3-year battle with AIDS and makes arrangements to die. He hosts a party to say goodbye to friends and family. His ex-partner, Brandon ""Gregory Harrison"", attends and things get complica...",622503.0,https://m.media-amazon.com/images/M/MV5BMTE2NDBjN2UtMDQ0MS00NjdjLWFjNzktMTVjM2RhMzhkMzM1XkEyXkFqcGc@._V1_SX300.jpg,110.0,,685,It's My Party (1996),1996.0,success
tt0114048,Simon Wincer,"To keep the loyalty of a village during the Vietnam war, a U.S. Army officer and his unit struggle to deliver it a live elephant.",24670346.0,https://m.media-amazon.com/images/M/MV5BOTJjM2U4MGMtNThmNi00ODAzLWE1ZGEtMzkyOWFjMzE0YzNjXkEyXkFqcGc@._V1_SX300.jpg,107.0,48.0,688,Operation Dumbo Drop (1995),1995.0,success
tt0117104,Richard Benjamin,"Connie, unwed and pregnant, is heading to Boston by train when she meets wealthy newlyweds Hugh and Patricia. The train crashes, and when Connie comes to in the hospital, she is mistaken for Patricia, who died in the crash with Hugh.",10082005.0,https://m.media-amazon.com/images/M/MV5BMDQyZDhhNGUtNmIxMC00MWQ0LThlMzctMzg2M2RmMThhOWRlXkEyXkFqcGc@._V1_SX300.jpg,105.0,35.0,691,Mrs. Winterbourne (1996),1996.0,success
tt0117688,Norberto Barba,A robot soldier named Solo escapes after learning he will be deprogrammed and helps a village who are under attack by rebels.,5107669.0,https://m.media-amazon.com/images/M/MV5BZGRiYzgwODgtZTg3NC00MmU3LTlhNmYtYjM5MzQwMGU1OGZlXkEyXkFqcGc@._V1_SX300.jpg,94.0,,692,Solo (1996),1996.0,success
tt0116289,Steven Baigelman,An ex-convict and his bumbling crook brother fight for the same woman.,3124440.0,https://m.media-amazon.com/images/M/MV5BODBjMmYzYmItOWVkNy00YTAyLTkwM2YtMTlhNTY3Njc3YThjXkEyXkFqcGc@._V1_SX300.jpg,99.0,30.0,697,Feeling Minnesota (1996),1996.0,success
tt0109593,Zalman King,"A struggling American writer (England) and a fellow American expatriate (Mandylor) begin a sordid affair among the chaos and discord of 1940 Paris, France on the brink of World War II.",63174.0,https://m.media-amazon.com/images/M/MV5BZWJlNWZkNmEtMjc0ZC00NWRlLThjNDAtZDdmYjUzZDJlOTcxXkEyXkFqcGc@._V1_SX300.jpg,102.0,,698,Delta of Venus (1995),1995.0,success
tt0112368,Patrick Read Johnson,"A miserable fat teenager secretly has a crush on the class beauty, ends up becoming the surprising participant to dance with her at a high school dance, meaning he's got to get his act together with the help of his best friend.",4821759.0,https://m.media-amazon.com/images/M/MV5BNzcyZmM3YWMtNzYzMC00N2NiLTgzMWUtYjIzZWEyNzZlMWFiXkEyXkFqcGc@._V1_SX300.jpg,90.0,,700,Angus (1995),1995.0,success
tt0115742,Stacy Cochran,25 y.o. Patty is thrown off her horse and knocked out. Students from a boys' boarding school find her and smuggle her to John's room at the school as cops are looking for her at home.,516349.0,https://m.media-amazon.com/images/M/MV5BMmI2NTFlMjItODEyZC00ZjFhLWJmZDktOTczYmFhOWNlY2I1XkEyXkFqcGc@._V1_SX300.jpg,86.0,,703,Boys (1996),1996.0,success
tt3529404,Britt Allcroft,"From Britt Allcroft, creator of Thomas &amp; Friends, comes Mumfie's Quest. Discover how Mumfie the special elephant first meets his friends Scarecrow, Pinkey, Whale and many more. Share the excitement as they hunt for Pinkey's mother...",,https://m.media-amazon.com/images/M/MV5BMTg5MjA5OTgxOF5BMl5BanBnXkFtZTgwMzM2NjAyMTE@._V1_SX300.jpg,108.0,,704,"Quest, The (1996)",1996.0,success
tt0117784,Steve Gomer,"A white school teacher takes over a talented, but undisciplined black high school basketball team and turns them into a winning team.",10163782.0,https://m.media-amazon.com/images/M/MV5BOTQyOThjYTUtNzdjOS00ZWFkLTk4YTgtOTFlNDgyZTVhY2Y0XkEyXkFqcGdeQXVyNzc5MjA3OA@@._V1_SX300.jpg,99.0,,706,Sunset Park (1996),1996.0,success
tt0117107,Lee Tamahori,"In 1950's Los Angeles, a special crime squad of the LAPD investigates the murder of a young woman.",11526099.0,https://m.media-amazon.com/images/M/MV5BOTcwMDE3MTQ5OV5BMl5BanBnXkFtZTcwMzA0MDQ1NA@@._V1_SX300.jpg,107.0,51.0,707,Mulholland Falls (1996),1996.0,success
tt0095776,George Scribner,A lost and alone kitten joins a gang of dogs engaged in petty larceny in New York City.,74151346.0,https://m.media-amazon.com/images/M/MV5BMTAxMzMwNzQtNGYxNC00OTgwLWI3ZTgtMDBlOTE4MGFkMGEwXkEyXkFqcGc@._V1_SX300.jpg,74.0,58.0,709,Oliver & Company (1988),1988.0,success
tt0115851,Tom DeCerchio,Two over-loyal Celtic fans kidnap their opponent's star player in order to guarantee their team the championship.,9255027.0,https://m.media-amazon.com/images/M/MV5BZGQxYjg5OWItNmFmMS00MmQ0LThmMzMtMGJiMjNkZDdkMGVmXkEyXkFqcGc@._V1_SX300.jpg,91.0,34.0,710,Celtic Pride (1996),1996.0,success
tt0116322,Alan Shapiro,A teenage boy sent to spend the summer with his eccentric uncle on the Florida coast befriends a remarkable dolphin and takes on local bad guys who are polluting the water.,20080020.0,https://m.media-amazon.com/images/M/MV5BNWRmNzA4MmYtMThjZS00NzQ5LWI4MzItOWNlZjUxNDVmMzExXkEyXkFqcGc@._V1_SX300.jpg,95.0,43.0,711,Flipper (1996),1996.0,success
tt0112817,Jim Jarmusch,"On the run after murdering a man, accountant William Blake encounters a strange Native American man named Nobody who prepares him for his journey into the spiritual world.",1037847.0,https://m.media-amazon.com/images/M/MV5BZjdjN2Q4MzctOWZjMS00ZjZkLTg5OWQtM2NjMTliYmE3MTY1XkEyXkFqcGc@._V1_SX300.jpg,121.0,62.0,714,Dead Man (1995),1995.0,success
tt0117108,Harold Ramis,A family man who never has enough time for the things he wants to do takes advantage of the opportunity to have himself cloned.,21075014.0,https://m.media-amazon.com/images/M/MV5BZmE0NzY5NjgtZGNjOS00NTk4LThiMjctYTE3MzYxY2FiMzMyXkEyXkFqcGc@._V1_SX300.jpg,117.0,53.0,719,Multiplicity (1996),1996.0,success
tt0118114,Nick Park,A collection of some of the most popular work featuring Wallace and Gromit.,,https://m.media-amazon.com/images/M/MV5BMTUyNDMxOTIxOF5BMl5BanBnXkFtZTcwODA1NTcyMQ@@._V1_SX300.jpg,75.0,,720,Wallace & Gromit: The Best of Aardman Animation (1996),1996.0,success
tt0116827,Bruce Beresford,A lawyer assigned to the clemency case of a woman on death row finds himself forming a deep friendship with her while he tries to prevent her impending execution.,5939449.0,https://m.media-amazon.com/images/M/MV5BZjc2MzZlMDUtZGM2Yi00OGZjLWI3ODAtMDhmY2FjNjkyMDZkXkEyXkFqcGc@._V1_SX300.jpg,103.0,,726,Last Dance (1996),1996.0,success
tt0112701,John Schlesinger,"A recently orphaned young woman goes to live with eccentric relatives in Sussex, where she sets about improving their gloomy lives.",5682429.0,https://m.media-amazon.com/images/M/MV5BY2U2MmQ5MjMtNjEyMC00NDE3LTkyNDEtZjI3MTA3ODliNzI4XkEyXkFqcGc@._V1_SX300.jpg,105.0,82.0,728,Cold Comfort Farm (1995),1995.0,success
tt0116508,Phil Joanou,"A hardened New Orleans cop, Dave Robicheaux, finally tosses in the badge and settles into life on the bayou with his wife. But a bizarre plane crash draws him back into the fray when his family is viciously threatened.",5009305.0,https://m.media-amazon.com/images/M/MV5BY2NiNTRiYjktNDBlNS00ZGJkLTgwMmMtNmEwMTAzNzY2YzM4XkEyXkFqcGc@._V1_SX300.jpg,132.0,,731,Heaven's Prisoners (1996),1996.0,success
tt0369249,Mitchell Kozuchowski,,,,24.0,,733,"Rock, The (1996)",1996.0,success
tt0117998,Jan de Bont,Two storm chasers on the brink of divorce must work together to create an advanced weather alert system by putting themselves in the cross-hairs of extremely violent tornadoes.,241830615.0,https://m.media-amazon.com/images/M/MV5BNGVhY2JjYzgtYjAyOC00ODg0LTliYWEtMzliZWYzMjA2NjYyXkEyXkFqcGc@._V1_SX300.jpg,113.0,68.0,736,Twister (1996),1996.0,success
tt0115624,David Hogan,"During the Second American Civil War in 2017, Barb Wire owns a nightclub called the Hammerhead. Things become complicated when her ex-lover Axel Hood, who is married to the fugitive Corrina Devonshire, re-enters her life.",3793614.0,https://m.media-amazon.com/images/M/MV5BOTVlNGQ5YTEtNzdkZi00MzRkLTk4NGUtMGYyNTkzMjU0MmIyXkEyXkFqcGc@._V1_SX300.jpg,98.0,40.0,737,Barb Wire (1996),1996.0,success
tt0117894,Tom Holland,An obese attorney is cursed by a gypsy to rapidly and uncontrollably lose weight.,15315484.0,https://m.media-amazon.com/images/M/MV5BNWFhY2U2NWUtOWMwZC00ODMxLTgwNGEtZmE4ZDZlMDJmNThlXkEyXkFqcGc@._V1_SX300.jpg,93.0,33.0,742,Thinner (1996),1996.0,success
tt0117723,Rick Friedberg,"Dick Steele, Agent WD-40 is assigned by his Director, to stop the evil General Rancor from destroying the world. WD-40 believed Rancor was dead and he teams up with the hot KGB Agent Veronique Ukrinsky to find Rancor and save the ...",26960191.0,https://m.media-amazon.com/images/M/MV5BOTEzMTZiMDgtMzI2MS00MzU3LWI2M2QtZWMzOTM0MTM5ZDQyXkEyXkFqcGc@._V1_SX300.jpg,81.0,25.0,743,Spy Hard (1996),1996.0,success
tt0112691,Nick Park,Wallace's whirlwind romance with the owner of the local wool shop puts his head in a spin; Gromit is framed for sheep-rustling in a fiendish criminal plot.,112175.0,https://m.media-amazon.com/images/M/MV5BM2M4ZmEzYzEtNjk0ZS00ODZkLTkxZjYtNTY4Njg2YjhhMWNkXkEyXkFqcGc@._V1_SX300.jpg,31.0,,745,Wallace & Gromit: A Close Shave (1995),1995.0,success
,,,,,,,343,"Baby-Sitters Club, The (1995)",1995.0,failed
,,,,,,,345,"Adventures of Priscilla, Queen of the Desert, The (1994)",1994.0,failed
,,,,,,,346,Backbeat (1993),1993.0,failed
,,,,,,,350,"Client, The (1994)",1994.0,failed
,,,,,,,353,"Crow, The (1994)",1994.0,failed
,,,,,,,355,"Flintstones, The (1994)",1994.0,failed
,,,,,,,362,"Jungle Book, The (1994)",1994.0,failed
,,,,,,,363,"Wonderful, Horrible Life of Leni Riefenstahl, The (Macht der Bilder: Leni Riefenstahl, Die) (1993)",1993.0,failed
,,,,,,,364,"Lion King, The (1994)",1994.0,failed
,,,,,,,366,"Wes Craven's New Nightmare (Nightmare on Elm Street Part 7: Freddy's Finale, A) (1994)",1994.0,failed
,,,,,,,367,"Mask, The (1994)",1994.0,failed
,,,,,,,371,"Paper, The (1994)",1994.0,failed
,,,,,,,373,Red Rock West (1992),1992.0,failed
,,,,,,,376,"River Wild, The (1994)",1994.0,failed
,,,,,,,385,"Man of No Importance, A (1994)",1994.0,failed
,,,,,,,387,"Low Down Dirty Shame, A (1994)",1994.0,failed
,,,,,,,388,Boys Life (1995),1995.0,failed
,,,,,,,389,"Colonel Chabert, Le (1994)",1994.0,failed
,,,,,,,405,Highlander III: The Sorcerer (a.k.a. Highlander: The Final Dimension) (1994),1994.0,failed
,,,,,,,407,In the Mouth of Madness (1995),1995.0,failed
,,,,,,,412,"Age of Innocence, The (1993)",1993.0,failed
,,,,,,,414,"Air Up There, The (1994)",1994.0,failed
,,,,,,,418,Being Human (1993),1993.0,failed
,,,,,,,419,"Beverly Hillbillies, The (1993)",1993.0,failed
,,,,,,,422,Blink (1994),1994.0,failed
,,,,,,,428,"Bronx Tale, A (1993)",1993.0,failed
,,,,,,,438,"Cowboy Way, The (1994)",1994.0,failed
